{
  "schema_version": "ctoa.conditions-shadow-trace.v1",
  "trace_id": "fixture-p9-trace",
  "source": "fixture",
  "evaluated_at_unix_ms": 1783799999000,
  "mode": "shadow_only",
  "status": "shadow_plan_ready",
  "action": "plan_paralyze_recovery",
  "condition": "paralyze",
  "spell": "exura",
  "input_sha256": {
    "profile": "bbbbbbbbbbbbbbbbbbbbbbbbbbbbbbbbbbbbbbbbbbbbbbbbbbbbbbbbbbbbbbbb",
    "observation": "bbbbbbbbbbbbbbbbbbbbbbbbbbbbbbbbbbbbbbbbbbbbbbbbbbbbbbbbbbbbbbbb",
    "p8_proof": "bbbbbbbbbbbbbbbbbbbbbbbbbbbbbbbbbbbbbbbbbbbbbbbbbbbbbbbbbbbbbbbb",
    "recovery_trace": "bbbbbbbbbbbbbbbbbbbbbbbbbbbbbbbbbbbbbbbbbbbbbbbbbbbbbbbbbbbbbbbb",
    "recovery_proof": "bbbbbbbbbbbbbbbbbbbbbbbbbbbbbbbbbbbbbbbbbbbbbbbbbbbbbbbbbbbbbbbb"
  },
  "canonical_input_sha256": "bbbbbbbbbbbbbbbbbbbbbbbbbbbbbbbbbbbbbbbbbbbbbbbbbbbbbbbbbbbbbbbb",
  "observation_age_ms": 1000,
  "p8_age_ms": 1000,
  "recovery_trace_age_ms": 1000,
  "recovery_age_ms": 1000,
  "decision": "would_plan_paralyze_recovery",
  "blockers": [],
  "decision_sha256": "aaaaaaaaaaaaaaaaaaaaaaaaaaaaaaaaaaaaaaaaaaaaaaaaaaaaaaaaaaaaaaaa",
  "operator_review_required": true,
  "dispatch_allowed": false,
  "runtime_actions": false,
  "executes_plan": false,
  "execute_once_allowed": false,
  "promotion_allowed": false,
  "intrusive_actions_performed": []
}
